{
  "id": "svc-00123",
  "serviceType": "Custodial",
  "description": "Custodial services at federal building",
  "location": "Pentagon, Arlington, VA",
  "state": "VA",
  "nonprofitAffiliate": "SourceAmerica",
  "performingAgency": "SERVICEMASTER",
  "approvalDate": "2010-06-01",
  "status": "active"
}